,Sentences
394,basis over their estimated useful lives. The estimated useful life and amortisation
395,"method are reviewed at the end of each annual reporting period, with the effect"
396,of any changes in estimate being accounted for on a prospective basis.
397,Amortisation on items of intangible asset is calculated using the straight-line
398,method to allocate their amortisable amounts over their estimated useful lives as
399,"The residual values, estimated useful lives and amortisation method of intangible"
400,"asset are reviewed, and adjusted as appropriate, at each balance sheet date. The"
401,effects of any revision are recognised in profit or loss when the changes arise.T S GLOBAL PROCUREMENT COMPANY PTE. LTD.
402,NOTES TO THE FINANCIAL STATEMENT
403,For the financial year ended 31 March 2020
404,Significant accounting policies (continued)
405,Impairment of non-financial assets
406,Equipment are tested for impairment whenever there is any objective evidence or
407,indication that these assets may be impaired.
408,"For the purpose of impairment testing of assets, recoverable amount (i.e. the higher of"
409,the fair value less cost to sell and the value-in-use) is determined on an individual asset
410,basis unless the asset does not generate cash flows that are largely independent of those
411,"from other assets. If this is the case, the  recoverable amount is determined for the cash-"
412,generating unit (CGU) to which the asset belongs.
413,If the recoverable amount of the asset or CGU is estimated to be less than its carrying
414,"amount, the carrying amount of the asset is reduced to its recoverable amount."
415,If the recoverable amount of the asset or cash-generating units (CGU) is estimated to be
416,"less than its carrying amount, the carrying amount of the asset is reduced to its"
417,recoverable amount.
418,The difference between the carrying amount and recoverable amount is recognised as an
419,impairment loss in profit or loss.
420,"An impairment loss for an asset is reversed if, and only if, there has been a change in the"
421,estimates used to determine the asset’s recoverable amount since the last impairment
422,loss was recognised. The carrying amount of this asset is increased to its revised
423,"recoverable amount, provided that this amount does not exceed the carrying amount that"
424,would have been determined (net of accumulated depreciation) had no impairment loss
425,been recognised for the asset in prior years.
426,A reversal of impairment loss for an asset is recognised in profit or loss.T S GLOBAL PROCUREMENT COMPANY PTE. LTD.
427,NOTES TO THE FINANCIAL STATEMENT
428,For the financial year ended 31 March 2020
429,Significant accounting policies (continued)
430,Financial assets
431,The accounting for financial assets before 1 April 2018 under FRS 39 are as
432,Loans and receivables
433,Cash and bank deposits
434,Trade and other receivables
435,Loan receivables
436,"Bank balances, trade and other receivables and loan receivables are initially"
437,recognised at fair values plus transaction costs and subsequently carried at
438,"amortised cost using the effective interest method, less accumulated impairment"
439,The Company assesses at each balance sheet date whether there is objective
440,evidence that a financial asset or a group of financial assets is impaired and
441,recognises an allowance for impairment when such evidence exists. Significant
442,"financial difficulties of the debtor, probability that the debtor will enter bankruptcy"
443,and default or significant delay in payments are objective evidence that these
444,financial assets are impaired.
445,The carrying amount of these assets are reduced through the use of an
446,impairment allowance account which is calculated as the difference between the
447,"carrying amount and the present value of estimated future cash flows, discounted"
448,at the original effective interest rate.
449,The accounting for financial assets from 1 April 2018 under FRS 109 are as
450,The Company classifies all of its financial assets (except for derivative financial
451,instruments referred in Note 2.13) into the amortised cost following measurement
452,The classification of debt instruments depends on the Company’s business model
453,for managing the financial assets as well as the contractual terms of the cash
454,flows of the financial assets.
455,Financial assets with embedded derivatives are considered in their entirety when
456,determining whether their cash flows are solely payment of principal and interest.
457,The Company reclassifies debt instruments when and only when its business
458,model for managing those assets changes.T S GLOBAL PROCUREMENT COMPANY PTE. LTD.
459,NOTES TO THE FINANCIAL STATEMENT
460,For the financial year ended 31 March 2020
461,Significant accounting policies (continued)
462,Financial assets (continued)
463,The accounting for financial assets from 1 April 2018 under FRS 109 are as
464,follows: (continued)
465,At initial recognition
466,"At initial recognition, the Company measures a financial asset at its fair"
467,"value plus, in the case of a financial asset not at fair value through profit"
468,"or loss, transaction costs that are directly attributable to the acquisition"
469,of the financial assets. Transaction costs of financial assets carried at fair
470,value through profit or loss are expensed in profit or loss.
471,At subsequent measurement
472,Debt instruments of the Company mainly comprise of cash and  bank
473,"deposits, trade and other receivables and loan receivables."
474,"There are three prescribed subsequent measurement categories,"
475,depending on the Company’s business model in managing the assets and
476,the cash flow characteristic of the assets. The Company manages these
477,group of financial assets by collecting the contractual cash flow and these
478,cash flows represents solely payment of principal and interest.
479,"Accordingly, these group of financial assets are measured at amortised"
480,cost subsequent to initial recognition.
481,A gain or loss on a debt investment that is subsequently measured at
482,amortised cost and is not part of a hedging relationship is recognised in
483,profit or loss when the asset is derecognised or impaired. Interest income
484,from these financial assets are recognised using the effective interest rate
485,The Company assesses on forward looking basis the expected credit
486,losses associated with its debt instruments carried at amortised cost.
487,For trade receivables (excluding trade receivables due from ultimate
488,"holding company and related companies), the Company applied the"
489,"simplified approach permitted by the FRS 109, which requires expected"
490,lifetime losses to be recognised from initial recognition of the receivables.
491,For trade receivables due from ultimate holding company and related
492,"companies, loan receivables, other receivables and cash and bank"
493,"deposits, the general 3-stage approach is applied. Credit loss allowance"
494,is based on 12-month expected credit loss if there is no significant
495,increase in credit risk since initial recognition of the assets. If there is a
496,"significant increase in credit risk since initial recognition, lifetime"
497,expected credit loss will be calculated and recognised.T S GLOBAL PROCUREMENT COMPANY PTE. LTD.
498,NOTES TO THE FINANCIAL STATEMENT
499,For the financial year ended 31 March 2020
500,Significant accounting policies (continued)
501,Derivative financial instruments
502,The company enters into foreign exchange forward contracts to manage its exposure to
503,in foreign exchange rate risk. Further details are disclosed in Note 11 to the financial
504,statements. A derivative financial instruments for which no hedge accounting is applied
505,is initially recognised at its fair value on the date the contract is entered into and is
506,subsequently carried at its fair value. Changes in its fair value are recognised in profit or
507,loss. The Company does not apply hedge accounting for its derivative financial
508,instruments. A derivative is presented as a non-current asset or a non-current liability if
509,the remaining maturity of the instrument is more than 12 months and it is not expected
510,to be realised or settled within 12 months.
511,Trade and other payables
512,Trade and other payables represent liabilities for goods and services provided to the
513,Company prior to the end of financial year which are unpaid. They are classified as current
514,liabilities if payment is due within one year or less (or in the normal operating cycle of
515,"the business, if longer). Otherwise, they are presented as non-current liabilities."
516,"Trade and other payables are initially recognised at fair value, and subsequently carried"
517,at amortised cost using the effective interest method.
518,Borrowings are presented as current liabilities unless the Company has an unconditional
519,"right to defer settlement for at least 12 months after the balance sheet date, in which"
520,case they are presented as non-current liabilities.
521,Borrowings are initially recognised at fair values (net of transaction costs) and
522,subsequently carried at amortised cost. Any difference between the proceeds (net of
523,transaction costs) and the redemption value is recognised in profit or loss over the period
524,of the borrowings using the effective interest method.
525,2.16    Provisions
526,"(legal or constructive) as a result of a past event, it is probable that the company will be"
527,"required to settle the obligation, and a reliable estimate can be made of the amount of"
528,The amount recognised as a provision is the best estimate of the consideration required
529,"to settle the present obligation at the end of the reporting period, taking into account the"
530,risks and uncertainties surrounding the obligation. Where a provision is measured using
531,"the cash flows estimated to settle the present obligation, its carrying amount is the"
532,present value of those cash flows.
533,When some or all of the economic benefits required to settle a provision are expected to
534,"be recovered from a third party, the receivable is recognized as an asset if it is virtually"
535,certain that reimbursement will be received and the amount of the receivable can be
536,measured reliably.T S GLOBAL PROCUREMENT COMPANY PTE. LTD.
537,NOTES TO THE FINANCIAL STATEMENT
538,For the financial year ended 31 March 2020
539,Significant accounting policies (continued)
540,2.17   Fair value estimation of financial assets and financial liabilities
541,The fair values of financial instruments traded in active markets (such as exchange-traded
542,and over-the-counter securities and derivatives) are based on quoted market prices at
543,the balance sheet date. The quoted market prices used for financial assets are the current
544,bid prices; the appropriate quoted market prices used for financial liabilities are the
545,current asking prices.
546,The fair values of financial instruments that are not traded in an active market are
547,determined by using valuation techniques. The Company uses a variety of methods and
548,makes assumptions based on market conditions that are existing at each balance sheet
549,"date. Where appropriate, quoted market prices or dealer quotes for similar instruments"
550,"are used. Valuation techniques, such as discounted cash flow analysis, are also used to"
551,determine the fair values of the financial instruments.
552,The fair values of currency forwards are determined using actively quoted forward
553,exchange rates. The fair values of interest rate swaps are calculated as the present value
554,of the estimated future cash flows discounted at actively quoted interest rates.
555,The fair values of current financial assets and liabilities carried at amortised cost
556,approximate their carrying amounts.
557,Offsetting financial instruments
558,Financial assets and liabilities are offset and the net amount reported in the balance sheet
559,when there is a legally enforceable right to offset and there is an intention to settle on a
560,net basis or realise the asset and settle the liability simultaneously.
561,Cash and cash equivalents
562,"For the purpose of presentation in the statement of cash flows, cash and cash equivalents"
563,"include cash on hand, deposits with financial institutions which are subject to an"
564,insignificant risk of change in value.
565,Currency translation
566,"The financial statements are presented in United States Dollar (“US$’’), which is the"
567,functional currency of the Company.
568,Transactions in a currency other than United States Dollar (“foreign currency”) are
569,translated into United States Dollar using the exchange rates at the dates of the
570,transactions. Currency exchange differences resulting from the settlement of such
571,transactions and from the translation of monetary assets and liabilities denominated in
572,foreign currencies at the closing rates at the balance sheet date are recognised in profit
573,or loss. Non-monetary items measured at fair values in foreign currencies are translated
574,using the exchange rates at the date when the fair values are determined.
575,Foreign exchange gains and losses impacting profit or loss are presented within ‘other
576,Ordinary shares are classified as equity. Incremental costs directly attributable to the
577,issuance of new ordinary shares are deducted against the share capital account.T S GLOBAL PROCUREMENT COMPANY PTE. LTD.
578,NOTES TO THE FINANCIAL STATEMENT
579,For the financial year ended 31 March 2020
580,"Critical accounting estimates, assumptions and judgements"
581,"Estimates, assumptions and judgements are continually evaluated and are based on"
582,"historical experience and other factors, including expectations of future events that are"
583,believed to be reasonable under the circumstances.
584,Expected credit losses (ECL) on receivables from related companies
585,The majority of the Company’s receivables are due from ultimate holding
586,"company, related companies, immediate holding company and a subsidiary as"
587,disclosed in Notes 10 and 13.
588,These receivables are subject to ECLs which are unbiased probability-weighted
589,estimates of credit losses which are determined by evaluating a range of possible
590,"outcomes and taking into account past events, current conditions and assessment"
591,of future economic conditions.
592,"Where necessary, the Company makes allowances for impairment on its"
593,"receivables due from ultimate holding company, related companies, immediate"
594,holding company and a subsidiary based on an assessment of their recoverability.
595,"The carrying amount of receivables due from ultimate holding company, related"
596,"companies, immediate holding company and a subsidiary at the end of the"
597,reporting period are disclosed in Notes 10 and 13 to the financial statements.
598,"Allowances are applied to receivables due from ultimate holding company, related"
599,"companies, immediate holding company and a subsidiary where it has been"
600,assessed based on management’s best estimates that the counterparty will not
601,be able to meet its contractual cash flows. Where expectations changes from the
602,"original estimate, such differences will impact the carrying value of receivables"
603,"due from ultimate holding company, related companies, immediate holding"
604,company and a subsidiary and related allowance for impairment in profit or loss
605,in the period in which such estimate changes.
606,"As at the date of the balance sheet, management has assessed that there is no"
607,material ECLs that needs to be recorded on its receivables due from ultimate
608,"holding company, related companies, immediate holding company and a"
609,4(a).    Revenue from contracts with customers
610,Sale of goods to ultimate holding company
611,Sale of goods to related companies
612,Service income arising from the purchase of debts of
613,a related company from outside parties
614,"4,359,545T S GLOBAL PROCUREMENT COMPANY PTE. LTD."
615,NOTES TO THE FINANCIAL STATEMENT
616,For the financial year ended 31 March 2020
617,4(b). Expenses by nature
618,Freight and handling
619,Total cost of sales
620,Administration expenses
621,Total cost of sales and admin expenses
622,Interest income from financial assets measured at
623,- Loan to subsidiary
624,- Loan to immediate holding company
625,- Loan to related companies
626,Net fair value gains on derivative financial instruments
627,Net currency exchange gains
628,Other income from related companies
629,Finance Expenses
630,Interest expense on loans from:
631,- Immediate holding company
632,- Related companies
633,Interest expense on bank loans
634,Interest expense on Lease
635,"180,431T S GLOBAL PROCUREMENT COMPANY PTE. LTD."
636,NOTES TO THE FINANCIAL STATEMENT
637,For the financial year ended 31 March 2020
638,Income tax expense
639,Current income tax
640,- under provision in prior year
641,Deferred tax (Note 18)
642,Total tax expense
643,The income tax varied from the amount of income tax determined by applying
644,the Singapore income tax rate of 17% to profit before income tax as a result of
645,the following differences:
646,Profit before tax
647,Income tax at statutory rate 17% (2019: 17%)
648,Effect of tax concession for GTP transactions
649,Under provision in prior year
650,Tax-exempt income and rebate
651,Movements in current income tax liabilities
652,Beginning of financial year
653,Under-provision in preceding financial years
654,End of financial year
655,"During the year ended 31 March 2018, the company was awarded an extension"
656,to its Global Trader Programme (“GTP”) status by International Enterprise
657,"Singapore (“IE Singapore”) for a period of 4 years 10 months, effective from 1"
658,"June 2017 and ending on 31 March 2022. Under the GTP status, the company"
659,enjoys a concessionary tax rate of 10% for profits derived from qualifying
660,"activities. Profits from non-qualifying sources, if any, are taxed at 17%.T S GLOBAL PROCUREMENT COMPANY PTE. LTD."
661,NOTES TO THE FINANCIAL STATEMENT
662,For the financial year ended 31 March 2020
663,Cash and bank deposits
664,"* Amount is less than US$ 1,000."
665,Trade and other receivables
666,Trade receivables*
667,Sales of goods to ultimate holding company
668,Sales of goods to related companies
669,Other receivables
670,Accrued interest income on debenture loans to
671,subsidiary (Note13)
672,Accrued interest income on loans to immediate holding
673,company (Note13)
674,Accrued interest income on loans to related companies
675,Accrued interest income on finance lease
676,Advances to a related company
677,Other receivables from related companies
678,Finance lease receivable from related companies
679,Deferred expenses
680,Total trade and other receivables
681,* The average credit period on sales of goods is 3 to 180 days (2019: 3 to 180 days).T S GLOBAL PROCUREMENT COMPANY PTE. LTD.
682,NOTES TO THE FINANCIAL STATEMENT
683,For the financial year ended 31 March 2020
684,Derivative financial instruments
685,Forward foreign exchange contracts - unrealised fair value
686,Forward foreign exchange contracts - unrealised fair value
687,The company utilises currency derivatives to hedge significant future transactions and
688,cash flows. The company is party to a variety of forward foreign exchange contracts in
689,the management of its exchange rate exposures.
690,"At the end of the reporting period, the total notional amount of outstanding forward"
691,foreign  exchange contracts to which the company is committed are as follows:
692,Forward foreign exchange contracts
693,These arrangements are designed to address significant exchange exposure during the
694,Changes in the fair value of derivative financial instruments
695,Opening fair value of derivative financial instruments
696,Fair value gains on derivative financial instruments
697,recognised in profit or loss (Note 6)
698,Net closing fair value of derivative financial instruments
699,"20,009T S GLOBAL PROCUREMENT COMPANY PTE. LTD."
700,NOTES TO THE FINANCIAL STATEMENT
701,For the financial year ended 31 March 2020
702,Derivative financial instruments (continued)
703,The following table details the forward foreign currency contracts outstanding as at
704,Outstanding contracts
705,gains / (losses)
706,less than 3 months
707,less than 3 months
708,less than 3 months
709,less than 3 months
710,The following table details the forward foreign currency contracts outstanding as at
711,Outstanding contracts
712,gains / (losses)
713,less than 3 months
714,less than 3 months
715,less than 3 months
716,less than 3 months
717,"20,009T S GLOBAL PROCUREMENT COMPANY PTE. LTD."
718,NOTES TO THE FINANCIAL STATEMENT
719,For the financial year ended 31 March 2020
720,Goods held for sale
721,13.       Loan receivables
722,Loan receivables consist of:
723,"As at 31 March 2020, loan receivables of US$ 2,153,049,000 (2019:"
724,"US$803,630,000) from immediate holding company, T S Global Holdings Pte. Ltd."
725,"are under cash-pooling arrangement, unsecured, bear interest ranging from"
726,0.43% to 0.60% (2019: 0.37% to 0.60%) per annum and are repayable upon
727,"As at 31 March 2020, a loan receivable of NIL (2019: US$390,000,000) is due"
728,"from immediate holding company, T S Global Holdings Pte. Ltd. The loan was fully"
729,repaid in January 2020.
730,"As at 31 March 2020, US$ 153,229,000 (2019: US$150,200,000) due from a"
731,"related company, Tata Steel Europe Ltd and US$ 40,000,000 (2019:"
732,"US$40,000,000) is due from Tata Steel Minerals Canada Limited."
733,Loan receivables from Tata Steel Europe Ltd are unsecured and bear interest at
734,12 months LIBOR + 4.00% per annum (2019: 12 months LIBOR + 4.00% per
735,annum). These loans are repayable by September 2020 and March 2021. The
736,related company has the option to repay the loans earlier without any penalty.
737,"Loan receivables from Tata Steel Minerals Canada Limited are unsecured, bear"
738,interest at 7% and are repayable within 1 year from the balance sheet date. The
739,related company has the option to repay the loans earlier without any penalty.
740,"As at 31 March 2020, debenture loans of NIL (2019: US$1,108,508,000) to"
741,"subsidiary, Proco Issuer Pte. Ltd. are unsecured. The debenture loans were fully"
742,repaid in March 2020.
743,Immediate holding company (i)  (ii)
744,Related companies (iii)
745,Debenture on loans to subsidiary (iv)
746,"2,492,338T S GLOBAL PROCUREMENT COMPANY PTE. LTD."
747,NOTES TO THE FINANCIAL STATEMENT
748,For the financial year ended 31 March 2020
749,14.      Investment in subsidiary
750,Details of company’s subsidiary at 31 March 2020 are as follows:
751,Name of subsidiary
752,Proco Issuer Pte. Ltd.
753,Dealing in factoring
754,"* Amount is less than US $ 1,000."
755,At 31 March 2019
756,At 31 March 2020
757,Accumulated depreciation:
758,Depreciation expense
759,At 31 March 2019
760,Depreciation expense
761,At 31 March 2020
762,Carrying amount:
763,At 31 March 2020
764,At 31 March 2019
765,"Unquoted equity shares, at cost"
766,*T S GLOBAL PROCUREMENT COMPANY PTE. LTD.
767,NOTES TO THE FINANCIAL STATEMENT
768,For the financial year ended 31 March 2020
769,16.    Intangible assets
770,At 31 March 2019
771,At 31 March 2020
772,Accumulated amortization:
773,Amortization expense
774,At 31 March 2019
775,Amortization expenses
776,Carrying amount:
777,At 31 March 2020
778,At 31 March 2019
779,"*Intangible assets under development as at 31 March 2020, US$ NIL (2019: 128,000)."
780,17.    Right to use assets
781,At 31 March 2019
782,At 31 March 2020
783,Accumulated depreciation:
784,At 31 March 2019
785,Depreciation expense
786,Carrying amount:
787,At 31 March 2020
788,"25,900T S GLOBAL PROCUREMENT COMPANY PTE. LTD."
789,NOTES TO THE FINANCIAL STATEMENT
790,For the financial year ended 31 March 2020
791,18.     Deferred tax asset
792,Beginning of financial year
793,- profit or loss (Note 8)
794,End of financial year
795,The movement in deferred income tax assets and liabilities (prior to offsetting of balances)
796,during the financial year is as follows:
797,Credited / charged to profit or loss for the
798,year (Note 8(a))
799,At 31 March 2019
800,Credited / charged to profit or loss for the
801,year (Note 8(a))
802,At 31 March 2020
803,220T S GLOBAL PROCUREMENT COMPANY PTE. LTD.
804,NOTES TO THE FINANCIAL STATEMENT
805,For the financial year ended 31 March 2020
806,Trade and other payables
807,- Non-related parties
808,- Related parties
809,Accrued interest expense on loans from:
810,Immediate holding company
811,Related companies
812,Accrued interest expense on short-term bank loans
813,Withholding tax payable
814,Other payable to:
815,Immediate holding company
816,Related companies
817,Other payables and accrued expenses
818,* The credit period on trade payables ranges from 3 to 60 days (2019: 3 to 60 days).
819,Interest is not charged on the outstanding balances.
820,20.      Loan payables
821,Immediate holding company (i)
822,Related companies (ii)
823,Less: Loan payables due in more than 12 months(i)and (ii)
824,Loan payables consist of:
825,"As at 31 March 2020, short-term loan payables of US$ 418,937,000 (2019:"
826,"US$951,338,000) due to the immediate holding company, T S Global Holdings"
