,Sentences
0,T S GLOBAL PROCUREMENT COMPANY PTE. LTD.
1,(Incorporated in Singapore. Registration Number: 201008706C)
2,For the financial year ended 31 March 2020T S GLOBAL PROCUREMENT COMPANY PTE. LTD.
3,(Incorporated in Singapore)
4,For the financial year ended 31 March 2020
5,Directors’ Statement
6,Independent Auditor’s Report
7,Statement of Comprehensive Income
8,Statement of Changes in Equity
9,Statement of Cash Flows
10,Notes to the Financial Statements
11,11T S GLOBAL PROCUREMENT COMPANY PTE. LTD.
12,DIRECTORS’ STATEMENT
13,For the financial year ended 31 March 2020
14,The directors present their statement to the member together with the audited financial
15,statements for the financial year ended 31 March 2020.
16,"In the opinion of the directors,"
17,the financial statements as set out on pages 6 to ▪ are drawn up so as to give a true and
18,fair view of the financial position of the Company as at 31 March 2020 and the financial
19,"performance, changes in equity and cash flows of the Company for the financial year"
20,covered by the financial statements; and
21,"at the date of this statement, there are reasonable grounds to believe that the Company"
22,will be able to pay its debts as and when they fall due.
23,The directors of the Company in office at the date of this statement are as follows:
24,Mr Koushik Chatterjee
25,Mr Rajiv Mukerji
26,Mr Dibyendu Bose
27,Arrangements to enable directors to acquire shares and debentures
28,Neither at the end of nor at any time during the financial year was the Company a party to any
29,arrangement whose object was to enable the directors of the Company to acquire benefits by
30,"means of the acquisition of shares in, or debentures of, the Company or any other body corporate."
31,Directors’ interests in shares or debentures
32,"According to the register of directors’ shareholdings, none of the directors holding office at the"
33,end of the financial year had any interest in the shares or debentures of the Company or its
34,"related corporations, except as follows:"
35,Name of the director and company in which
36,interests are held
37,At beginning of year
38,Tata Steel Limited
39,(Ordinary shares of Rupees 10 each)
40,Koushik Chatterjee
41,"1,531T S GLOBAL PROCUREMENT COMPANY PTE. LTD."
42,DIRECTORS’ STATEMENT
43,For the financial year ended 31 March 2020
44,No options were granted during the financial year to subscribe for unissued shares of
45,No shares were issued during the financial year by virtue of the exercise of options to take up
46,unissued shares of the Company.
47,There were no unissued shares of the Company under option at the end of the financial year.
48,Independent auditor
49,"The independent auditor, PricewaterhouseCoopers LLP, has expressed its willingness to accept"
50,On behalf of the Directors
51,Koushik Chatterjee
52,INDEPENDENT AUDITOR’S REPORT TO THE MEMBER OF T S GLOBAL PROCUREMENT
53,COMPANY PTE. LTD.
54,Report on the Audit of the Financial Statements
55,"In our opinion, the accompanying financial statements of T S Global Procurement Company Pte."
56,Ltd. (“the Company”) are properly drawn up in accordance with the provisions of the Companies
57,"Act, Chapter 50 (“the Act”) and Financial Reporting Standards in Singapore (“FRSs”) so as to give"
58,a true and fair view of the financial position of the Company as at 31 March 2020 and of the
59,"financial performance, changes in equity and cash flows of the Company for the financial year"
60,ended on that date.
61,What we have audited
62,The financial statements of the Company comprise:
63,the statement of comprehensive income for the financial year ended 31 March 2020;
64,the balance sheet as at 31 March 2020;
65,the statement of changes in equity for the financial year then ended;
66,the statement of cash flows for the financial year then ended; and
67,"the notes to the financial statements, including a summary of significant accounting policies."
68,Basis for Opinion
69,We conducted our audit in accordance with Singapore Standards on Auditing (“SSAs”). Our
70,responsibilities under those standards are further described in the Auditor’s Responsibilities for
71,the Audit of the Financial Statements section of our report.
72,We believe that the audit evidence we have obtained is sufficient and appropriate to provide a
73,basis for our opinion.
74,We are independent of the Company in accordance with the Accounting and Corporate Regulatory
75,Authority Code of Professional Conduct and Ethics for Public Accountants and Accounting Entities
76,(“ACRA Code”) together with the ethical requirements that are relevant to our audit of the
77,"financial statements in Singapore, and we have fulfilled our other ethical responsibilities in"
78,accordance with these requirements and the ACRA Code.
79,Other Information
80,Management is responsible for the other information. The other information comprises the
81,Directors’ Statement but does not include the financial statements and our auditor’s report
82,Our opinion on the financial statements does not cover the other information and we do not
83,express any form of assurance conclusion thereon.
84,"In connection with our audit of the financial statements, our responsibility is to read the other"
85,"information and, in doing so, consider whether the other information is materially inconsistent"
86,"with the financial statements or our knowledge obtained in the audit, or otherwise appears to be"
87,"materially misstated. If, based on the work we have performed, we conclude that there is a"
88,"material misstatement of this other information, we are required to report that fact. We have"
89,nothing to report in this regard.4
90,INDEPENDENT AUDITOR’S REPORT TO THE MEMBER OF T S GLOBAL PROCUREMENT
91,COMPANY PTE. LTD. (continued)
92,Responsibilities of Management and Directors for the Financial Statements
93,Management is responsible for the preparation of financial statements that give a true and fair
94,"view in accordance with the provisions of the Act and FRSs, and for devising and maintaining a"
95,system of internal accounting controls sufficient to provide a reasonable assurance that assets
96,are safeguarded against loss from unauthorised use or disposition; and transactions are properly
97,authorised and that they are recorded as necessary to permit the preparation of true and fair
98,financial statements and to maintain accountability of assets.
99,"In preparing the financial statements, management is responsible for assessing the Company’s"
100,"ability to continue as a going concern, disclosing, as applicable, matters related to going concern"
101,and using the going concern basis of accounting unless management either intends to liquidate
102,"the Company or to cease operations, or has no realistic alternative but to do so."
103,The directors’ responsibilities include overseeing the Company’s financial reporting process.
104,Auditor’s Responsibilities for the Audit of the Financial Statements
105,Our objectives are to obtain reasonable assurance about whether the financial statements as a
106,"whole are free from material misstatement, whether due to fraud or error, and to issue an"
107,"auditor’s report that includes our opinion. Reasonable assurance is a high level of assurance, but"
108,is not a guarantee that an audit conducted in accordance with SSAs will always detect a material
109,misstatement when it exists. Misstatements can arise from fraud or error and are considered
110,"material if, individually or in the aggregate, they could reasonably be expected to influence the"
111,economic decisions of users taken on the basis of these financial statements.
112,"As part of an audit in accordance with SSAs, we exercise professional judgement and maintain"
113,professional scepticism throughout the audit. We also:
114,"Identify and assess the risks of material misstatement of the financial statements, whether"
115,"due to fraud or error, design and perform audit procedures responsive to those risks, and"
116,obtain audit evidence that is sufficient and appropriate to provide a basis for our opinion. The
117,risk of not detecting a material misstatement resulting from fraud is higher than for one
118,"resulting from error, as fraud may involve collusion, forgery, intentional omissions,"
119,"misrepresentations, or the override of internal control."
120,Obtain an understanding of internal control relevant to the audit in order to design audit
121,"procedures that are appropriate in the circumstances, but not for the purpose of expressing"
122,an opinion on the effectiveness of the Company’s internal control.
123,Evaluate the appropriateness of accounting policies used and the reasonableness of
124,accounting estimates and related disclosures made by management.
125,Conclude on the appropriateness of management’s use of the going concern basis of
126,"accounting and, based on the audit evidence obtained, whether a material uncertainty exists"
127,related to events or conditions that may cast significant doubt on the Company’s ability to
128,"continue as a going concern. If we conclude that a material uncertainty exists, we are required"
129,to draw attention in our auditor’s report to the related disclosures in the financial statements
130,"or, if such disclosures are inadequate, to modify our opinion. Our conclusions are based on"
131,"the audit evidence obtained up to the date of our auditor’s report. However, future events or"
132,conditions may cause the Company to cease to continue as a going concern.5
133,INDEPENDENT AUDITOR’S REPORT TO THE MEMBER OF T S GLOBAL PROCUREMENT
134,COMPANY PTE. LTD.  (continued)
135,Auditor’s Responsibilities for the Audit of the Financial Statements (continued)
136,"Evaluate the overall presentation, structure and content of the financial statements, including"
137,"the disclosures, and whether the financial statements represent the underlying transactions"
138,and events in a manner that achieves fair presentation.
139,"We communicate with the directors regarding, among other matters, the planned scope and"
140,"timing of the audit and significant audit findings, including any significant deficiencies in internal"
141,control that we identify during our audit.
142,Report on Other Legal and Regulatory Requirements
143,"In our opinion, the accounting and other records required by the Act to be kept by the Company"
144,have been properly kept in accordance with the provisions of the Act.
145,PricewaterhouseCoopers LLP
146,Public Accountants and Chartered Accountants
147,"Singapore, ■T S GLOBAL PROCUREMENT COMPANY PTE. LTD."
148,STATEMENT OF COMPREHENSIVE INCOME
149,For the financial year ended 31 March 2020
150,The accompanying notes form an integral part of these financial statements.
151,- Administrative
152,Profit before tax
153,Income tax expense
154,Profit after tax and total comprehensive
155,income for the year
156,"48,301T S GLOBAL PROCUREMENT COMPANY PTE. LTD."
157,As at 31 March 2020
158,The accompanying notes form an integral part of these financial statements.
159,Cash and bank deposits
160,Trade and other receivables
161,Derivatives financial instruments
162,Loan receivables
163,Non-current assets
164,Investment in subsidiary
165,Intangible assets
166,Right of use assets
167,Deferred tax asset
168,"26,328               346"
169,Current liabilities
170,Trade and other payables
171,Derivative financial instruments
172,Current income tax liabilities
173,Lease liabilities
174,Non-current liabilities
175,Lease liabilities
176,Total liabilities
177,Retained earnings
178,"*Amount is less than US$1,000T S GLOBAL PROCUREMENT COMPANY PTE. LTD."
179,STATEMENT OF CHANGES IN EQUITY
180,For the financial year ended 31 March 2020
181,The accompanying notes form an integral part of these financial statements.
182,Beginning of financial year
183,Profit for the year
184,End of financial year
185,Beginning of financial year
186,Profit for the year
187,End of financial year
188,"351,240T S GLOBAL PROCUREMENT COMPANY PTE. LTD."
189,STATEMENT OF CASH FLOWS
190,For the financial year ended 31 March 2020
191,The accompanying notes form an integral part of these financial statements.
192,Operating activities
193,Profit before tax
194,Adjustments for:
195,Interest expense
196,Depreciation and amortisation expense
197,Amortisation cost
198,Operating cash flows before movements in working
199,"Financial assets, at fair value through profit and loss"
200,Trade receivables
201,Other receivables
202,Other payables and accrued expenses
203,Cash generated from operations
204,Net cash generated from/(used in) operating activities
205,Investing activities
206,Interest received
207,Purchase of equipment and intangible asset
208,Loans to related companies
209,Repayments of loans to related companies
210,Loan to immediate holding company
211,Repayment of loan to immediate holding company
212,Debenture loans to subsidiary
213,Repayments of debenture loans to subsidiary
214,Net cash generated from investing activities
215,Financing activities
216,Repayments of loans from related companies
217,Loans from immediate holding company
218,Repayments of loans from immediate holding company
219,Increase in bank loans
220,Repayments of bank loans
221,Net cash generated from financing activities
222,"(343,701)T S GLOBAL PROCUREMENT COMPANY PTE. LTD."
223,STATEMENT OF CASH FLOWS
224,For the financial year ended 31 March 2020
225,The accompanying notes form an integral part of these financial statements.
226,Net (decrease)/increase in cash and cash equivalents
227,Cash and cash equivalents at beginning of financial
228,Cash and cash equivalents at end of financial year
229,"*Amount is less than US$1,000"
230,Reconciliation of liabilities arising from financial activities
231,"3,334,133T S GLOBAL PROCUREMENT COMPANY PTE. LTD."
232,NOTES TO THE FINANCIAL STATEMENT
233,For the financial year ended 31 March 2020
234,General information
235,The Company is incorporated in Singapore with its principal place of business and
236,"registered office at 22 Tanjong Kling Road, Singapore 628048."
237,The principal activity of the Company is that of trading of raw materials for steel making
238,"purposes, investment holding and debt financing."
239,Significant accounting policies
240,Basis of preparation
241,These financial statements have been prepared in accordance with Singapore Financial
242,"Reporting Standards (“FRS”) under the historical cost convention, except as disclosed in"
243,the accounting policies below:
244,The preparation of these financial statements in conformity with FRS requires
245,management to exercise its judgement in the process of applying the Company’s
246,accounting policies. It also requires the use of certain critical accounting estimates and
247,"assumptions. The areas involving a higher degree of judgement or complexity, or areas"
248,where estimates and assumptions are significant to the financial statements are disclosed
249,Interpretations and amendments to published standards effective in 2020
250,"On 1 April 2019, the Company adopted the new or amended FRS and Interpretations of"
251,FRS (“INT FRS”) that are mandatory for application for the financial year. Changes to the
252,"Company’s accounting policies have been made as required, in accordance with the"
253,transitional provisions in the respective FRS and INT FRS.
254,The adoption of these new or amended FRS and INT FRS did not result in substantial
255,changes to the Company’s accounting policies and had no material effect on the amounts
256,reported for the current or prior financial years except for the following:
257,Adoption of FRS 115 Revenue from Contracts with Customers
258,The Company has adopted the new standard using the retrospective approach
259,with the cumulative impact of the adoption recognised in the opening retained
260,earnings at 1 April 2018. Comparative information for 31 March 2018 are not
261,The accounting policies for revenue from contracts with customers under FRS 115
262,are disclosed in Note 2.2.
263,Adoption of FRS 109 Financial instruments
264,"The Company has adopted the new standard retrospectively from 1 April 2018,"
265,in line with the transition provision permitted under the standards. Comparatives
266,for financial year ended 2018 are not restated and the Company has recognised
267,any difference between the carrying amounts at 31 March 2018 and 1 April 2018
268,in the opening retained earnings.
269,The accounting policies for financial instruments under FRS 109 are disclosed in
270,Note 2.12.T S GLOBAL PROCUREMENT COMPANY PTE. LTD.
271,NOTES TO THE FINANCIAL STATEMENT
272,For the financial year ended 31 March 2020
273,Significant accounting policies (continued)
274,Basis of preparation (continued)
275,The adoption of FRS 115 and FRS 109 had no material effect on the amounts
276,reported in the current year or prior financial year.
277,Revenue from contracts with customers
278,Revenue comprise the fair value of the consideration received or receivable for the sale
279,of goods and rendering of services in the ordinary course of the Company's activities.
280,"Sales are presented, net of goods and services tax, rebates and discounts."
281,Revenue from sale of products is recognised at a point in time when control of
282,"the products has transferred, being when the products are delivered to the"
283,customer. Delivery occurs when the products have been shipped or delivered to
284,"the specific location as the case may be, the risks of loss has been transferred,"
285,and either the customer has accepted the products in accordance with the sales
286,"contract, or the Company has objective evidence that all criteria for acceptance"
287,"have been satisfied. Sale of products include related ancillary services, if any."
288,The Company does not have any contracts where the period between the transfer
289,of the promised goods or services to the customer and payment by the customer
290,"exceeds one year. As a consequence, the Company does not adjust any of the"
291,transaction prices for the time value of money.
292,Revenue from rendering of services of short duration is recognised when the
293,services are completed.
294,Interest income is recognised using the effective interest rate method.
295,"Dividend income is recognised when the right to receive payment is established,"
296,it is probable that that the economic benefits associated with the dividend will
297,"flow to the Company, and the amount of the dividend can be reliably measured."
298,Employee compensation
299,"Employee benefits are recognised as an expense, unless the cost qualifies to be"
300,capitalised as an asset.
301,Defined contribution plans
302,Defined contribution plans are post-employment benefit plans under which the
303,Company pays fixed contributions into separate entities such as The Central
304,"Provident Fund on a mandatory, contractual or voluntary basis. The Company has"
305,no further payment obligations once the contributions have been paid.T S GLOBAL PROCUREMENT COMPANY PTE. LTD.
306,NOTES TO THE FINANCIAL STATEMENT
307,For the financial year ended 31 March 2020
308,Significant accounting policies (continued)
309,Employee compensation (continued)
310,Employee leave entitlement
311,Employee entitlements to annual leave are recognised when they accrue to
312,employees. A provision is made for the estimated liability for annual leave as a
313,result of services rendered by employees up to the balance sheet date.
314,Borrowing costs are recognised in profit or loss using the effective interest method.
315,Current income tax for current and prior periods is recognised at the amount expected to
316,"be paid to or recovered from the tax authorities, using the tax rates and tax laws that"
317,have been enacted or substantively enacted by the balance sheet date.
318,Deferred income tax is recognised for all temporary differences arising between the tax
319,bases of assets and liabilities and their carrying amounts in the financial statements
320,except when the deferred income tax arises from the initial recognition of an asset or
321,liability that affects neither accounting nor taxable profit or loss at the time of the
322,Deferred income tax is measured at the tax rates that are expected to apply when the
323,"related deferred income tax asset is realised or the deferred income tax liability is settled,"
324,based on tax rates and tax laws that have been enacted or substantively enacted by the
325,balance sheet date.
326,"Current and deferred income taxes are recognised as income or expenses in profit or loss,"
327,except to the extent that the tax arises from a transaction which is recognised directly in
328,equity. Deferred tax arising from a business combination is adjusted against goodwill on
329,"The Company accounts for investment tax credits (for example, productivity and"
330,innovative credit) similar to accounting for other tax credits where deferred tax asset is
331,recognised for unused tax credits to the extent that it is probable that future taxable
332,profit will be available against which the unused tax credit can be utilised.
333,2.6     Exemption from preparing consolidated financial statements
334,These financial statements are the separate financial statements of the Company. The
335,Company is exempted from the preparation of consolidated financial statements as the
336,"Company is a wholly-owned subsidiary of Tata Steel Limited, incorporated in India, which"
337,prepares consolidated financial statements available for public use. The registered
338,address of Tata Steel Limited where the consolidated financial statements can be obtained
339,"is as follows: Bombay House, 24 Homi Mody Street, Mumbai 400001, India.T S GLOBAL PROCUREMENT COMPANY PTE. LTD."
340,NOTES TO THE FINANCIAL STATEMENT
341,For the financial year ended 31 March 2020
342,Significant accounting policies (continued)
343,Investment in subsidiary
344,A subsidiary is an entity that is controlled by another entity.
345,Control is achieved when the company:
346,Has power over the investee;
347,"Is exposed, or has rights, to variable returns from its involvement with the"
348,Has the ability to use its power to affect its returns.
349,The company reassesses whether or not it controls an investee if facts and circumstances
350,indicate that there are changes to one or more of the three elements of control listed
351,Investment in subsidiary is carried at cost less any impairment in net recoverable value
352,that has been recognised in profit or loss.
353,Inventories are carried at the lower of cost and net realisable value. Cost is determined
354,using the weighted average method. The cost of finished goods and work-in-progress
355,"comprises raw materials, direct labour, other direct costs and related production"
356,overheads (based on normal operating capacity) but excludes borrowing costs. Net
357,"realisable value is the estimated selling price in the ordinary course of business, less the"
358,estimated costs of completion and applicable variable selling expenses.
359,Equipment are recognised at cost less accumulated depreciation and accumulated
360,impairment losses.
361,All items of equipment are initially recognised at cost and subsequently carried
362,at cost less accumulated depreciation and accumulated impairment losses.
363,Components of costs
364,The cost of an item equipment initially recognised includes its purchase price and
365,any cost that is directly attributable to bringing the asset to the location and
366,condition necessary for it to be capable of operating in the manner intended by
367,management. Cost also includes borrowing costs and any fair value gains or
368,losses on qualifying cash flow hedges of equipment that are transferred from the
369,hedging reserve.
370,Subsequent expenditure
371,Subsequent expenditure relating to equipment that has already been recognised
372,is added to the carrying amount of the asset only when it is probable that future
373,economic benefits associated with the item will flow to the Company and the cost
374,of the item can be measured reliably. All other repair and maintenance expenses
375,are recognised in profit or loss when incurred.T S GLOBAL PROCUREMENT COMPANY PTE. LTD.
376,NOTES TO THE FINANCIAL STATEMENT
377,For the financial year ended 31 March 2020
378,Significant accounting policies (continued)
379,Equipment (continued)
380,Depreciation is calculated using the straight-line method to allocate depreciable
381,amounts over their estimated useful lives. The estimated useful lives are as
382,Office equipment
383,"The residual values, estimated useful lives and depreciation method of property,"
384,"plant and equipment are reviewed, and adjusted as appropriate, at each balance"
385,sheet date. The effects of any revision are recognised in profit or loss when the
386,"On disposal of an item of equipment, the difference between the disposal"
387,"proceeds and its carrying amount is recognised in profit or loss within ""other"
388,"gains"". Any amount in revaluation reserve relating to that item is transferred to"
389,retained profits directly.
390,Intangible Assets
391,Intangible assets acquired separately are reported at cost less accumulated
392,depreciation (where they have finite useful lives) and accumulated impairment
393,losses. Intangible assets with finite useful lives are amortised on a straight-line
